gif_index,url,total_gif_frames,frames_extracted,frame_extraction_ms,total_inference_ms,avg_frame_inference_ms,per_frame_inference_ms,summary_ms,ocr_detected,ocr_text,total_pipeline_ms,wall_clock_ms,since_page_load_ms,model_load_ms,ocr_load_ms,caption
1,"https://media2.giphy.com/media/v1.Y2lkPWVjOWY5Nzk1cHpmM21udmcweDRtczc3ankzZGJ5bD",21,16,244,882,53,"",0,0,"",1126,1133,1172,389,595,"a man is playing a guitar and jumping up and down."
2,"https://media4.giphy.com/media/v1.Y2lkPWVjOWY5Nzk1cHpmM21udmcweDRtczc3ankzZGJ5bD",16,16,1129,910,55,"",0,0,"",2040,2046,2084,0,0,"a is and"
3,"https://media1.giphy.com/media/v1.Y2lkPWVjOWY5Nzk1cHpmM21udmcweDRtczc3ankzZGJ5bD",26,16,2051,884,54,"",0,0,"",2935,2942,2981,0,0,"a woman is looking around and looking at something"
4,"https://media1.giphy.com/media/v1.Y2lkPWVjOWY5Nzk1cHpmM21udmcweDRtczc3ankzZGJ5bD",18,16,2963,883,53,"",0,0,"",3846,3853,3891,0,0,"a man is talking and looking at something"
5,"https://media4.giphy.com/media/v1.Y2lkPWVjOWY5Nzk1cHpmM21udmcweDRtczc3ankzZGJ5bD",35,16,3857,853,52,"",0,0,"",4710,4717,4755,0,0,"a man is dancing in a room full of"
6,"https://media1.giphy.com/media/v1.Y2lkPWVjOWY5Nzk1cHpmM21udmcweDRtczc3ankzZGJ5bD",16,16,4713,844,51,"",0,0,"",5556,5563,5601,0,0,"a man in a white suit is looking at something"
7,"https://media4.giphy.com/media/v1.Y2lkPWVjOWY5Nzk1cHpmM21udmcweDRtczc3ankzZGJ5bD",46,16,5562,851,51,"",0,0,"",6413,6420,6458,0,0,"a man is sitting on a couch and eating a cookie."
8,"https://media4.giphy.com/media/v1.Y2lkPWVjOWY5Nzk1cHpmM21udmcweDRtczc3ankzZGJ5bD",63,16,6419,833,51,"",0,0,"",7251,7257,7295,0,0,"a man in a hat is talking and smiling."
9,"https://media2.giphy.com/media/v1.Y2lkPWVjOWY5Nzk1cHpmM21udmcweDRtczc3ankzZGJ5bD",32,16,7255,840,51,"",0,0,"",8095,8102,8140,0,0,"a woman is wearing sunglasses and a hood."
10,"https://media2.giphy.com/media/v1.Y2lkPWVjOWY5Nzk1cHpmM21udmcweDRtczc3ankzZGJ5bD",91,16,8104,841,51,"",0,0,"",8945,8951,8989,0,0,"a man is holding a microphone and dancing."