gif_index,url,total_gif_frames,frames_extracted,frame_extraction_ms,total_inference_ms,avg_frame_inference_ms,per_frame_inference_ms,summary_ms,ocr_detected,ocr_text,total_pipeline_ms,wall_clock_ms,since_page_load_ms,model_load_ms,ocr_load_ms,caption
1,"https://media4.giphy.com/media/v1.Y2lkPWVjOWY5Nzk1cHpmM21udmcweDRtczc3ankzZGJ5bD",16,16,201,841,51,"",0,0,"",1042,1047,1068,389,595,"a is and"
2,"https://media2.giphy.com/media/v1.Y2lkPWVjOWY5Nzk1cHpmM21udmcweDRtczc3ankzZGJ5bD",21,16,1054,849,51,"",0,0,"",1902,1908,1929,0,0,"a man is playing a guitar and jumping up and down."
3,"https://media1.giphy.com/media/v1.Y2lkPWVjOWY5Nzk1cHpmM21udmcweDRtczc3ankzZGJ5bD",26,16,1906,839,51,"",0,0,"",2745,2751,2772,0,0,"a woman is looking around and looking at something"
4,"https://media1.giphy.com/media/v1.Y2lkPWVjOWY5Nzk1cHpmM21udmcweDRtczc3ankzZGJ5bD",18,16,2749,839,51,"",0,0,"",3588,3593,3614,0,0,"a man is talking and looking at something"
5,"https://media4.giphy.com/media/v1.Y2lkPWVjOWY5Nzk1cHpmM21udmcweDRtczc3ankzZGJ5bD",35,16,3598,843,51,"",0,0,"",4441,4446,4466,0,0,"a man is dancing in a room full of"
6,"https://media1.giphy.com/media/v1.Y2lkPWVjOWY5Nzk1cHpmM21udmcweDRtczc3ankzZGJ5bD",16,16,4443,847,51,"",0,0,"",5291,5295,5316,0,0,"a man in a white suit is looking at something"
7,"https://media4.giphy.com/media/v1.Y2lkPWVjOWY5Nzk1cHpmM21udmcweDRtczc3ankzZGJ5bD",46,16,5296,846,51,"",0,0,"",6142,6148,6168,0,0,"a man is sitting on a couch and eating a cookie."
8,"https://media2.giphy.com/media/v1.Y2lkPWVjOWY5Nzk1cHpmM21udmcweDRtczc3ankzZGJ5bD",91,16,6149,852,52,"",0,0,"",7001,7005,7026,0,0,"a man is holding a microphone and dancing."
9,"https://media4.giphy.com/media/v1.Y2lkPWVjOWY5Nzk1cHpmM21udmcweDRtczc3ankzZGJ5bD",63,16,7003,846,51,"",0,0,"",7849,7853,7874,0,0,"a man in a hat is talking and smiling."
10,"https://media2.giphy.com/media/v1.Y2lkPWVjOWY5Nzk1cHpmM21udmcweDRtczc3ankzZGJ5bD",32,16,7851,839,51,"",0,0,"",8690,8695,8716,0,0,"a woman is wearing sunglasses and a hood."