gif_index,url,total_gif_frames,frames_extracted,frame_extraction_ms,total_inference_ms,avg_frame_inference_ms,per_frame_inference_ms,summary_ms,ocr_detected,ocr_text,total_pipeline_ms,wall_clock_ms,since_page_load_ms,model_load_ms,ocr_load_ms,caption
1,"https://media4.giphy.com/media/v1.Y2lkPWVjOWY5Nzk1cHpmM21udmcweDRtczc3ankzZGJ5bD",16,16,2250,824,50,"",0,1,"DER Sub PRISE!",11759,11765,11780,380,558,"a is and. Text: DER Sub PRISE!"
2,"https://media2.giphy.com/media/v1.Y2lkPWVjOWY5Nzk1cHpmM21udmcweDRtczc3ankzZGJ5bD",21,16,3120,843,51,"",0,0,"",11789,11795,11810,0,0,"a man is playing a guitar and jumping up and down."
3,"https://media1.giphy.com/media/v1.Y2lkPWVjOWY5Nzk1cHpmM21udmcweDRtczc3ankzZGJ5bD",26,16,3963,838,51,"",0,0,"",11813,11820,11834,0,0,"a woman is looking around and looking at something"
4,"https://media4.giphy.com/media/v1.Y2lkPWVjOWY5Nzk1cHpmM21udmcweDRtczc3ankzZGJ5bD",35,16,4803,842,51,"",0,0,"",11937,11943,11958,0,0,"a man is dancing in a room full of"
5,"https://media1.giphy.com/media/v1.Y2lkPWVjOWY5Nzk1cHpmM21udmcweDRtczc3ankzZGJ5bD",18,16,5646,822,50,"",0,0,"",12028,12035,12049,0,0,"a man is talking and looking at something"
6,"https://media4.giphy.com/media/v1.Y2lkPWVjOWY5Nzk1cHpmM21udmcweDRtczc3ankzZGJ5bD",46,16,6468,836,51,"",0,0,"",12633,12640,12655,0,0,"a man is sitting on a couch and eating a cookie."
7,"https://media4.giphy.com/media/v1.Y2lkPWVjOWY5Nzk1cHpmM21udmcweDRtczc3ankzZGJ5bD",63,16,7306,835,51,"",0,1,"TRAITORS “Who Doesn't Like Surprises?",13204,13210,13224,0,0,"a man in a hat is talking and smiling.. Text: TRAITORS “Who Doesn't Like Surprises?"
8,"https://media1.giphy.com/media/v1.Y2lkPWVjOWY5Nzk1cHpmM21udmcweDRtczc3ankzZGJ5bD",16,16,8141,846,51,"",0,1,"ay Ce",13424,13431,13445,0,0,"a man in a white suit is looking at something. Text: ay Ce"
9,"https://media2.giphy.com/media/v1.Y2lkPWVjOWY5Nzk1cHpmM21udmcweDRtczc3ankzZGJ5bD",32,16,8987,839,51,"",0,0,"",13550,13557,13571,0,0,"a woman is wearing sunglasses and a hood."
10,"https://media2.giphy.com/media/v1.Y2lkPWVjOWY5Nzk1cHpmM21udmcweDRtczc3ankzZGJ5bD",91,16,9828,838,51,"",0,1,"Surprise! Surprise!",13762,13768,13782,0,0,"a man is holding a microphone and dancing.. Text: Surprise! Surprise!"