gif_index,url,total_gif_frames,frames_extracted,frame_extraction_ms,total_inference_ms,avg_frame_inference_ms,per_frame_inference_ms,summary_ms,ocr_detected,ocr_text,total_pipeline_ms,wall_clock_ms,since_page_load_ms,model_load_ms,ocr_load_ms,caption
1,"https://media2.giphy.com/media/v1.Y2lkPWVjOWY5Nzk1cHpmM21udmcweDRtczc3ankzZGJ5bD",21,16,217,845,51,"",0,0,"",1062,1066,1083,389,595,"a man is playing a guitar and jumping up and down."
2,"https://media1.giphy.com/media/v1.Y2lkPWVjOWY5Nzk1cHpmM21udmcweDRtczc3ankzZGJ5bD",26,16,1064,841,51,"",0,0,"",1905,1910,1927,0,0,"a woman is looking around and looking at something"
3,"https://media4.giphy.com/media/v1.Y2lkPWVjOWY5Nzk1cHpmM21udmcweDRtczc3ankzZGJ5bD",16,16,1908,865,53,"",0,0,"",2773,2777,2794,0,0,"a is and"
4,"https://media4.giphy.com/media/v1.Y2lkPWVjOWY5Nzk1cHpmM21udmcweDRtczc3ankzZGJ5bD",35,16,2782,842,51,"",0,0,"",3624,3628,3645,0,0,"a man is dancing in a room full of"
5,"https://media1.giphy.com/media/v1.Y2lkPWVjOWY5Nzk1cHpmM21udmcweDRtczc3ankzZGJ5bD",18,16,3626,838,51,"",0,0,"",4463,4467,4484,0,0,"a man is talking and looking at something"
6,"https://media1.giphy.com/media/v1.Y2lkPWVjOWY5Nzk1cHpmM21udmcweDRtczc3ankzZGJ5bD",16,16,4466,840,51,"",0,0,"",5306,5311,5327,0,0,"a man in a white suit is looking at something"
7,"https://media4.giphy.com/media/v1.Y2lkPWVjOWY5Nzk1cHpmM21udmcweDRtczc3ankzZGJ5bD",63,16,5311,836,51,"",0,0,"",6147,6151,6168,0,0,"a man in a hat is talking and smiling."
8,"https://media4.giphy.com/media/v1.Y2lkPWVjOWY5Nzk1cHpmM21udmcweDRtczc3ankzZGJ5bD",46,16,6149,840,51,"",0,0,"",6989,6994,7011,0,0,"a man is sitting on a couch and eating a cookie."
9,"https://media2.giphy.com/media/v1.Y2lkPWVjOWY5Nzk1cHpmM21udmcweDRtczc3ankzZGJ5bD",32,16,6995,837,51,"",0,0,"",7832,7837,7854,0,0,"a woman is wearing sunglasses and a hood."
10,"https://media2.giphy.com/media/v1.Y2lkPWVjOWY5Nzk1cHpmM21udmcweDRtczc3ankzZGJ5bD",91,16,7841,836,51,"",0,0,"",8677,8680,8697,0,0,"a man is holding a microphone and dancing."