gif_index,url,total_gif_frames,frames_extracted,frame_extraction_ms,total_inference_ms,avg_frame_inference_ms,per_frame_inference_ms,summary_ms,ocr_detected,ocr_text,total_pipeline_ms,wall_clock_ms,since_page_load_ms,model_load_ms,ocr_load_ms,caption
1,"https://media2.giphy.com/media/v1.Y2lkPWVjOWY5Nzk1cHpmM21udmcweDRtczc3ankzZGJ5bD",21,16,2267,836,50,"",0,0,"",11740,11744,11756,380,558,"a man is playing a guitar and jumping up and down."
2,"https://media4.giphy.com/media/v1.Y2lkPWVjOWY5Nzk1cHpmM21udmcweDRtczc3ankzZGJ5bD",16,16,3979,832,51,"",0,1,"DER Sub PRISE!",11810,11814,11827,0,0,"a is and. Text: DER Sub PRISE!"
3,"https://media1.giphy.com/media/v1.Y2lkPWVjOWY5Nzk1cHpmM21udmcweDRtczc3ankzZGJ5bD",26,16,3149,829,50,"",0,0,"",11835,11839,11852,0,0,"a woman is looking around and looking at something"
4,"https://media1.giphy.com/media/v1.Y2lkPWVjOWY5Nzk1cHpmM21udmcweDRtczc3ankzZGJ5bD",18,16,4812,842,51,"",0,0,"",11927,11931,11944,0,0,"a man is talking and looking at something"
5,"https://media4.giphy.com/media/v1.Y2lkPWVjOWY5Nzk1cHpmM21udmcweDRtczc3ankzZGJ5bD",35,16,5654,842,51,"",0,0,"",12049,12052,12065,0,0,"a man is dancing in a room full of"
6,"https://media1.giphy.com/media/v1.Y2lkPWVjOWY5Nzk1cHpmM21udmcweDRtczc3ankzZGJ5bD",16,16,6497,846,51,"",0,1,"ay Ce",12627,12631,12644,0,0,"a man in a white suit is looking at something. Text: ay Ce"
7,"https://media4.giphy.com/media/v1.Y2lkPWVjOWY5Nzk1cHpmM21udmcweDRtczc3ankzZGJ5bD",46,16,7343,838,51,"",0,0,"",12888,12893,12906,0,0,"a man is sitting on a couch and eating a cookie."
8,"https://media4.giphy.com/media/v1.Y2lkPWVjOWY5Nzk1cHpmM21udmcweDRtczc3ankzZGJ5bD",63,16,8183,837,51,"",0,1,"TRAITORS “Who Doesn't Like Surprises?",13457,13460,13473,0,0,"a man in a hat is talking and smiling.. Text: TRAITORS “Who Doesn't Like Surprises?"
9,"https://media2.giphy.com/media/v1.Y2lkPWVjOWY5Nzk1cHpmM21udmcweDRtczc3ankzZGJ5bD",32,16,9020,837,51,"",0,0,"",13582,13586,13598,0,0,"a woman is wearing sunglasses and a hood."
10,"https://media2.giphy.com/media/v1.Y2lkPWVjOWY5Nzk1cHpmM21udmcweDRtczc3ankzZGJ5bD",91,16,9858,837,51,"",0,1,"Surprise! Surprise!",13793,13796,13808,0,0,"a man is holding a microphone and dancing.. Text: Surprise! Surprise!"