gif_index,url,total_gif_frames,frames_extracted,frame_extraction_ms,total_inference_ms,avg_frame_inference_ms,per_frame_inference_ms,summary_ms,ocr_detected,ocr_text,total_pipeline_ms,wall_clock_ms,since_page_load_ms,model_load_ms,ocr_load_ms,caption
1,"https://media4.giphy.com/media/v1.Y2lkPWVjOWY5Nzk1cHpmM21udmcweDRtczc3ankzZGJ5bD",16,16,2233,822,50,"",0,1,"DER Sub PRISE!",11836,11842,11857,380,558,"a is and. Text: DER Sub PRISE!"
2,"https://media2.giphy.com/media/v1.Y2lkPWVjOWY5Nzk1cHpmM21udmcweDRtczc3ankzZGJ5bD",21,16,3097,852,51,"",0,0,"",11865,11870,11885,0,0,"a man is playing a guitar and jumping up and down."
3,"https://media1.giphy.com/media/v1.Y2lkPWVjOWY5Nzk1cHpmM21udmcweDRtczc3ankzZGJ5bD",26,16,3950,865,52,"",0,0,"",11889,11895,11910,0,0,"a woman is looking around and looking at something"
4,"https://media1.giphy.com/media/v1.Y2lkPWVjOWY5Nzk1cHpmM21udmcweDRtczc3ankzZGJ5bD",18,16,4816,861,52,"",0,0,"",11982,11987,12002,0,0,"a man is talking and looking at something"
5,"https://media4.giphy.com/media/v1.Y2lkPWVjOWY5Nzk1cHpmM21udmcweDRtczc3ankzZGJ5bD",35,16,5678,862,52,"",0,0,"",12106,12112,12126,0,0,"a man is dancing in a room full of"
6,"https://media1.giphy.com/media/v1.Y2lkPWVjOWY5Nzk1cHpmM21udmcweDRtczc3ankzZGJ5bD",16,16,6541,862,52,"",0,1,"ay Ce",12328,12333,12348,0,0,"a man in a white suit is looking at something. Text: ay Ce"
7,"https://media4.giphy.com/media/v1.Y2lkPWVjOWY5Nzk1cHpmM21udmcweDRtczc3ankzZGJ5bD",46,16,7402,839,51,"",0,0,"",12942,12949,12963,0,0,"a man is sitting on a couch and eating a cookie."
8,"https://media2.giphy.com/media/v1.Y2lkPWVjOWY5Nzk1cHpmM21udmcweDRtczc3ankzZGJ5bD",32,16,8242,837,51,"",0,0,"",13068,13074,13088,0,0,"a woman is wearing sunglasses and a hood."
9,"https://media4.giphy.com/media/v1.Y2lkPWVjOWY5Nzk1cHpmM21udmcweDRtczc3ankzZGJ5bD",63,16,9081,830,50,"",0,1,"TRAITORS “Who Doesn't Like Surprises?",13698,13703,13718,0,0,"a man in a hat is talking and smiling.. Text: TRAITORS “Who Doesn't Like Surprises?"
10,"https://media2.giphy.com/media/v1.Y2lkPWVjOWY5Nzk1cHpmM21udmcweDRtczc3ankzZGJ5bD",91,16,9912,836,51,"",0,1,"Surprise! Surprise!",13857,13862,13877,0,0,"a man is holding a microphone and dancing.. Text: Surprise! Surprise!"