gif_index,url,total_gif_frames,frames_extracted,frame_extraction_ms,total_inference_ms,avg_frame_inference_ms,per_frame_inference_ms,summary_ms,ocr_detected,ocr_text,total_pipeline_ms,wall_clock_ms,since_page_load_ms,model_load_ms,ocr_load_ms,caption
1,"https://media4.giphy.com/media/v1.Y2lkPWVjOWY5Nzk1cHpmM21udmcweDRtczc3ankzZGJ5bD",16,16,2238,828,50,"",0,1,"DER Sub PRISE!",11866,11870,11882,380,558,"a is and. Text: DER Sub PRISE!"
2,"https://media2.giphy.com/media/v1.Y2lkPWVjOWY5Nzk1cHpmM21udmcweDRtczc3ankzZGJ5bD",21,16,3111,844,51,"",0,0,"",11894,11899,11911,0,0,"a man is playing a guitar and jumping up and down."
3,"https://media1.giphy.com/media/v1.Y2lkPWVjOWY5Nzk1cHpmM21udmcweDRtczc3ankzZGJ5bD",26,16,3955,866,52,"",0,0,"",11919,11923,11935,0,0,"a woman is looking around and looking at something"
4,"https://media1.giphy.com/media/v1.Y2lkPWVjOWY5Nzk1cHpmM21udmcweDRtczc3ankzZGJ5bD",18,16,4822,866,52,"",0,0,"",12064,12069,12081,0,0,"a man is talking and looking at something"
5,"https://media4.giphy.com/media/v1.Y2lkPWVjOWY5Nzk1cHpmM21udmcweDRtczc3ankzZGJ5bD",35,16,5689,866,52,"",0,0,"",12136,12140,12152,0,0,"a man is dancing in a room full of"
6,"https://media4.giphy.com/media/v1.Y2lkPWVjOWY5Nzk1cHpmM21udmcweDRtczc3ankzZGJ5bD",46,16,6555,843,51,"",0,0,"",12751,12756,12768,0,0,"a man is sitting on a couch and eating a cookie."
7,"https://media1.giphy.com/media/v1.Y2lkPWVjOWY5Nzk1cHpmM21udmcweDRtczc3ankzZGJ5bD",16,16,7399,845,51,"",0,1,"ay Ce",12973,12977,12989,0,0,"a man in a white suit is looking at something. Text: ay Ce"
8,"https://media4.giphy.com/media/v1.Y2lkPWVjOWY5Nzk1cHpmM21udmcweDRtczc3ankzZGJ5bD",63,16,8246,851,52,"",0,1,"TRAITORS “Who Doesn't Like Surprises?",13548,13552,13564,0,0,"a man in a hat is talking and smiling.. Text: TRAITORS “Who Doesn't Like Surprises?"
9,"https://media2.giphy.com/media/v1.Y2lkPWVjOWY5Nzk1cHpmM21udmcweDRtczc3ankzZGJ5bD",91,16,9098,837,51,"",0,1,"Surprise! Surprise!",13792,13795,13807,0,0,"a man is holding a microphone and dancing.. Text: Surprise! Surprise!"
10,"https://media2.giphy.com/media/v1.Y2lkPWVjOWY5Nzk1cHpmM21udmcweDRtczc3ankzZGJ5bD",32,16,9935,838,51,"",0,0,"",13886,13891,13903,0,0,"a woman is wearing sunglasses and a hood."