gif_index,url,total_gif_frames,frames_extracted,frame_extraction_ms,total_inference_ms,avg_frame_inference_ms,per_frame_inference_ms,summary_ms,ocr_detected,ocr_text,total_pipeline_ms,wall_clock_ms,since_page_load_ms,model_load_ms,ocr_load_ms,caption
1,"https://media4.giphy.com/media/v1.Y2lkPWVjOWY5Nzk1cHpmM21udmcweDRtczc3ankzZGJ5bD",16,16,2255,844,51,"",0,1,"DER Sub PRISE!",11884,11889,11900,380,558,"a is and. Text: DER Sub PRISE!"
2,"https://media2.giphy.com/media/v1.Y2lkPWVjOWY5Nzk1cHpmM21udmcweDRtczc3ankzZGJ5bD",21,16,3144,867,52,"",0,0,"",11913,11918,11929,0,0,"a man is playing a guitar and jumping up and down."
3,"https://media1.giphy.com/media/v1.Y2lkPWVjOWY5Nzk1cHpmM21udmcweDRtczc3ankzZGJ5bD",26,16,4010,865,52,"",0,0,"",11937,11943,11954,0,0,"a woman is looking around and looking at something"
4,"https://media4.giphy.com/media/v1.Y2lkPWVjOWY5Nzk1cHpmM21udmcweDRtczc3ankzZGJ5bD",35,16,4878,847,51,"",0,0,"",12064,12068,12079,0,0,"a man is dancing in a room full of"
5,"https://media1.giphy.com/media/v1.Y2lkPWVjOWY5Nzk1cHpmM21udmcweDRtczc3ankzZGJ5bD",18,16,5725,844,51,"",0,0,"",12156,12161,12172,0,0,"a man is talking and looking at something"
6,"https://media4.giphy.com/media/v1.Y2lkPWVjOWY5Nzk1cHpmM21udmcweDRtczc3ankzZGJ5bD",46,16,6568,843,51,"",0,0,"",12771,12776,12787,0,0,"a man is sitting on a couch and eating a cookie."
7,"https://media2.giphy.com/media/v1.Y2lkPWVjOWY5Nzk1cHpmM21udmcweDRtczc3ankzZGJ5bD",32,16,7412,840,51,"",0,0,"",12898,12903,12914,0,0,"a woman is wearing sunglasses and a hood."
8,"https://media4.giphy.com/media/v1.Y2lkPWVjOWY5Nzk1cHpmM21udmcweDRtczc3ankzZGJ5bD",63,16,8254,850,51,"",0,1,"TRAITORS “Who Doesn't Like Surprises?",13467,13471,13482,0,0,"a man in a hat is talking and smiling.. Text: TRAITORS “Who Doesn't Like Surprises?"
9,"https://media2.giphy.com/media/v1.Y2lkPWVjOWY5Nzk1cHpmM21udmcweDRtczc3ankzZGJ5bD",91,16,9105,841,51,"",0,1,"Surprise! Surprise!",13794,13799,13809,0,0,"a man is holding a microphone and dancing.. Text: Surprise! Surprise!"
10,"https://media1.giphy.com/media/v1.Y2lkPWVjOWY5Nzk1cHpmM21udmcweDRtczc3ankzZGJ5bD",16,16,9947,845,51,"",0,1,"ay Ce",13898,13902,13913,0,0,"a man in a white suit is looking at something. Text: ay Ce"