gif_index,url,total_gif_frames,frames_extracted,frame_extraction_ms,total_inference_ms,ocr_detected,ocr_text,total_pipeline_ms,wall_clock_ms,since_page_load_ms,model_load_ms,ocr_load_ms,caption
1,"https://media2.giphy.com/media/v1.Y2lkPWVjOWY5Nzk1eTJ5amNtd2Z3cW5uNm43aWJvazA2Yj",91,16,3134,15182,0,"",18755,18759,18792,27760,460,"A woman was walking on stage and waving her hand behind her."
2,"https://media3.giphy.com/media/v1.Y2lkPWVjOWY5Nzk1eTJ5amNtd2Z3cW5uNm43aWJvazA2Yj",16,16,3068,15176,0,"",18674,37434,37467,0,0,"A man with a tie and shirt was talking while sitting at a desk."
3,"https://media4.giphy.com/media/v1.Y2lkPWVjOWY5Nzk1eTJ5amNtd2Z3cW5uNm43aWJvazA2Yj",63,16,3085,15140,0,"",18664,56098,56131,0,0,"A man with a hat and coat smiles at something on the screen."
4,"https://media1.giphy.com/media/v1.Y2lkPWVjOWY5Nzk1eTJ5amNtd2Z3cW5uNm43aWJvazA2Yj",18,16,3039,15244,0,"",18718,74816,74850,0,0,"A man with black hair and wearing a shirt is looking up and talking."
5,"https://media1.giphy.com/media/v1.Y2lkPWVjOWY5Nzk1eTJ5amNtd2Z3cW5uNm43aWJvazA2Yj",26,16,3030,14958,0,"",18419,93236,93269,0,0,"A bird with big eyes was looking at something."
6,"https://media1.giphy.com/media/v1.Y2lkPWVjOWY5Nzk1eTJ5amNtd2Z3cW5uNm43aWJvazA2Yj",16,16,3030,15460,0,"",18937,112173,112206,0,0,"A blue and yellow frame with text reading surprise! Surprise? sits on top of another image that"
7,"https://media4.giphy.com/media/v1.Y2lkPWVjOWY5Nzk1eTJ5amNtd2Z3cW5uNm43aWJvazA2Yj",35,16,3046,15000,0,"",18481,130654,130687,0,0,"A woman with red and blue colors was shocked by something."
8,"https://media2.giphy.com/media/v1.Y2lkPWVjOWY5Nzk1eTJ5amNtd2Z3cW5uNm43aWJvazA2Yj",32,16,3066,15136,0,"",18636,149290,149323,0,0,"A woman with blonde hair and blue eyes wearing glasses ."
9,"https://media4.giphy.com/media/v1.Y2lkPWVjOWY5Nzk1eTJ5amNtd2Z3cW5uNm43aWJvazA2Yj",46,16,3067,15422,0,"",18928,168218,168251,0,0,"A boy with black hair and wearing a fire truck shirt was walking on dirt roads near trees."
10,"https://media1.giphy.com/media/v1.Y2lkPWVjOWY5Nzk1eTJ5amNtd2Z3cW5uNm43aWJvazA2Yj",15,16,3021,15131,0,"",18596,186814,186847,0,0,"A man with a black shirt and brown hair was looking at something."