gif_index,url,total_gif_frames,frames_extracted,frame_extraction_ms,total_inference_ms,ocr_detected,ocr_text,total_pipeline_ms,wall_clock_ms,since_page_load_ms,model_load_ms,ocr_load_ms,caption
1,"https://media2.giphy.com/media/v1.Y2lkPWVjOWY5Nzk1MGQyaTBhajAxdGxvaml5cHU4aWZmbG",91,16,3097,14859,1,"Surprise! Surprise!",18405,18409,18482,24552,450,"A woman was walking on stage and waving her hand behind her.. Text: Surprise! Surprise!"
2,"https://media3.giphy.com/media/v1.Y2lkPWVjOWY5Nzk1MGQyaTBhajAxdGxvaml5cHU4aWZmbG",16,16,3058,14997,1,"ay Ce",18498,36907,36979,0,0,"A man with a tie and shirt was talking while sitting at a desk.. Text: ay Ce"
3,"https://media4.giphy.com/media/v1.Y2lkPWVjOWY5Nzk1MGQyaTBhajAxdGxvaml5cHU4aWZmbG",63,16,3083,14781,1,"TRAITORS “Who Doesn't Like Surprises?",18322,55228,55301,0,0,"A man with a hat and coat smiles at something on the screen.. Text: TRAITORS “Who Doesn't Like Surprises?"
4,"https://media1.giphy.com/media/v1.Y2lkPWVjOWY5Nzk1MGQyaTBhajAxdGxvaml5cHU4aWZmbG",18,16,3045,14933,0,"",18428,73657,73730,0,0,"A man with black hair and wearing a shirt is looking up and talking."
5,"https://media1.giphy.com/media/v1.Y2lkPWVjOWY5Nzk1MGQyaTBhajAxdGxvaml5cHU4aWZmbG",26,16,3032,14644,0,"",18120,91777,91850,0,0,"A bird with big eyes was looking at something."
6,"https://media1.giphy.com/media/v1.Y2lkPWVjOWY5Nzk1MGQyaTBhajAxdGxvaml5cHU4aWZmbG",16,16,3031,15088,1,"DER Sub PRISE!",18573,110350,110422,0,0,"A blue and yellow frame with text reading surprise! Surprise? sits on top of another image that. Text: DER Sub PRISE!"
7,"https://media4.giphy.com/media/v1.Y2lkPWVjOWY5Nzk1MGQyaTBhajAxdGxvaml5cHU4aWZmbG",35,16,3050,14780,0,"",18282,128632,128705,0,0,"A woman with red and blue colors was shocked by something."
8,"https://media4.giphy.com/media/v1.Y2lkPWVjOWY5Nzk1MGQyaTBhajAxdGxvaml5cHU4aWZmbG",32,16,3064,14755,0,"",18241,146873,146946,0,0,"A woman with blonde hair and blue eyes wearing glasses ."
9,"https://media4.giphy.com/media/v1.Y2lkPWVjOWY5Nzk1MGQyaTBhajAxdGxvaml5cHU4aWZmbG",46,16,3076,15148,0,"",18672,165545,165618,0,0,"A boy with black hair and wearing a fire truck shirt was walking on dirt roads near trees."
10,"https://media1.giphy.com/media/v1.Y2lkPWVjOWY5Nzk1MGQyaTBhajAxdGxvaml5cHU4aWZmbG",15,16,3026,14857,0,"",18318,183863,183936,0,0,"A man with a black shirt and brown hair was looking at something."