gif_index,url,total_gif_frames,frames_extracted,frame_extraction_ms,total_inference_ms,ocr_detected,ocr_text,total_pipeline_ms,wall_clock_ms,since_page_load_ms,model_load_ms,ocr_load_ms,caption
1,"https://media2.giphy.com/media/v1.Y2lkPWVjOWY5Nzk1MGQyaTBhajAxdGxvaml5cHU4aWZmbG",91,16,3100,14857,1,"Surprise! Surprise!",18391,18396,18455,24552,450,"A woman was walking on stage and waving her hand behind her.. Text: Surprise! Surprise!"
2,"https://media3.giphy.com/media/v1.Y2lkPWVjOWY5Nzk1MGQyaTBhajAxdGxvaml5cHU4aWZmbG",16,16,3067,14909,1,"ay Ce",18412,36808,36867,0,0,"A man with a tie and shirt was talking while sitting at a desk.. Text: ay Ce"
3,"https://media4.giphy.com/media/v1.Y2lkPWVjOWY5Nzk1MGQyaTBhajAxdGxvaml5cHU4aWZmbG",63,16,3086,14872,1,"TRAITORS “Who Doesn't Like Surprises?",18406,55213,55273,0,0,"A man with a hat and coat smiles at something on the screen.. Text: TRAITORS “Who Doesn't Like Surprises?"
4,"https://media1.giphy.com/media/v1.Y2lkPWVjOWY5Nzk1MGQyaTBhajAxdGxvaml5cHU4aWZmbG",18,16,3042,15026,0,"",18514,73728,73787,0,0,"A man with black hair and wearing a shirt is looking up and talking."
5,"https://media1.giphy.com/media/v1.Y2lkPWVjOWY5Nzk1MGQyaTBhajAxdGxvaml5cHU4aWZmbG",26,16,3029,14665,0,"",18143,91871,91931,0,0,"A bird with big eyes was looking at something."
6,"https://media1.giphy.com/media/v1.Y2lkPWVjOWY5Nzk1MGQyaTBhajAxdGxvaml5cHU4aWZmbG",16,16,3031,15223,1,"DER Sub PRISE!",18706,110578,110637,0,0,"A blue and yellow frame with text reading surprise! Surprise? sits on top of another image that. Text: DER Sub PRISE!"
7,"https://media4.giphy.com/media/v1.Y2lkPWVjOWY5Nzk1MGQyaTBhajAxdGxvaml5cHU4aWZmbG",35,16,3044,14770,0,"",18251,128829,128889,0,0,"A woman with red and blue colors was shocked by something."
8,"https://media4.giphy.com/media/v1.Y2lkPWVjOWY5Nzk1MGQyaTBhajAxdGxvaml5cHU4aWZmbG",32,16,3074,14768,0,"",18265,147095,147154,0,0,"A woman with blonde hair and blue eyes wearing glasses ."
9,"https://media4.giphy.com/media/v1.Y2lkPWVjOWY5Nzk1MGQyaTBhajAxdGxvaml5cHU4aWZmbG",46,16,3070,15092,0,"",18607,165701,165761,0,0,"A boy with black hair and wearing a fire truck shirt was walking on dirt roads near trees."
10,"https://media1.giphy.com/media/v1.Y2lkPWVjOWY5Nzk1MGQyaTBhajAxdGxvaml5cHU4aWZmbG",15,16,3022,14892,0,"",18356,184058,184117,0,0,"A man with a black shirt and brown hair was looking at something."