gif_index,url,total_gif_frames,frames_extracted,frame_extraction_ms,total_inference_ms,ocr_detected,ocr_text,total_pipeline_ms,wall_clock_ms,since_page_load_ms,model_load_ms,ocr_load_ms,caption
1,"https://media2.giphy.com/media/v1.Y2lkPWVjOWY5Nzk1OGxldnp0bG5maTF5cXlreXlhYnQ0OW",91,16,3118,14819,0,"",18376,18381,18416,27760,460,"A woman was walking on stage and waving her hand behind her."
2,"https://media3.giphy.com/media/v1.Y2lkPWVjOWY5Nzk1OGxldnp0bG5maTF5cXlreXlhYnQ0OW",16,16,3062,14845,0,"",18343,36723,36759,0,0,"A man with a tie and shirt was talking while sitting at a desk."
3,"https://media4.giphy.com/media/v1.Y2lkPWVjOWY5Nzk1OGxldnp0bG5maTF5cXlreXlhYnQ0OW",63,16,3080,14834,0,"",18348,55071,55107,0,0,"A man with a hat and coat smiles at something on the screen."
4,"https://media1.giphy.com/media/v1.Y2lkPWVjOWY5Nzk1OGxldnp0bG5maTF5cXlreXlhYnQ0OW",18,16,3039,14971,0,"",18443,73514,73550,0,0,"A man with black hair and wearing a shirt is looking up and talking."
5,"https://media1.giphy.com/media/v1.Y2lkPWVjOWY5Nzk1OGxldnp0bG5maTF5cXlreXlhYnQ0OW",26,16,3031,14619,0,"",18086,91600,91636,0,0,"A bird with big eyes was looking at something."
6,"https://media1.giphy.com/media/v1.Y2lkPWVjOWY5Nzk1OGxldnp0bG5maTF5cXlreXlhYnQ0OW",16,16,3029,15240,0,"",18706,110306,110342,0,0,"A blue and yellow frame with text reading surprise! Surprise? sits on top of another image that"
7,"https://media4.giphy.com/media/v1.Y2lkPWVjOWY5Nzk1OGxldnp0bG5maTF5cXlreXlhYnQ0OW",35,16,3050,14749,0,"",18231,128538,128573,0,0,"A woman with red and blue colors was shocked by something."
8,"https://media2.giphy.com/media/v1.Y2lkPWVjOWY5Nzk1OGxldnp0bG5maTF5cXlreXlhYnQ0OW",32,16,3061,14749,0,"",18246,146784,146820,0,0,"A woman with blonde hair and blue eyes wearing glasses ."
9,"https://media4.giphy.com/media/v1.Y2lkPWVjOWY5Nzk1OGxldnp0bG5maTF5cXlreXlhYnQ0OW",46,16,3065,15094,0,"",18599,165383,165419,0,0,"A boy with black hair and wearing a fire truck shirt was walking on dirt roads near trees."
10,"https://media1.giphy.com/media/v1.Y2lkPWVjOWY5Nzk1OGxldnp0bG5maTF5cXlreXlhYnQ0OW",15,16,3025,14917,0,"",18372,183754,183790,0,0,"A man with a black shirt and brown hair was looking at something."