gif_index,url,total_gif_frames,frames_extracted,frame_extraction_ms,total_inference_ms,ocr_detected,ocr_text,total_pipeline_ms,wall_clock_ms,since_page_load_ms,model_load_ms,ocr_load_ms,caption
1,"https://media2.giphy.com/media/v1.Y2lkPWVjOWY5Nzk1eTF5YXRlMHlwZjRzOWtmYzZ1ZDMzMW",91,16,3126,14707,1,"Surprise! Surprise!",18268,18271,18312,2120,219,"A woman was walking on stage and waving her hand behind her.. Text: Surprise! Surprise!"
2,"https://media3.giphy.com/media/v1.Y2lkPWVjOWY5Nzk1eTF5YXRlMHlwZjRzOWtmYzZ1ZDMzMW",16,16,3030,15019,1,"DER Sub PRISE!",18509,36780,36821,0,0,"A blue and yellow frame with text reading surprise! Surprise? sits on top of another image that. Text: DER Sub PRISE!"
3,"https://media1.giphy.com/media/v1.Y2lkPWVjOWY5Nzk1eTF5YXRlMHlwZjRzOWtmYzZ1ZDMzMW",16,16,3100,14755,1,"ay Ce",18291,55071,55112,0,0,"A man with a tie and shirt was talking while sitting at a desk.. Text: ay Ce"
4,"https://media0.giphy.com/media/v1.Y2lkPWVjOWY5Nzk1eTF5YXRlMHlwZjRzOWtmYzZ1ZDMzMW",26,16,3030,14442,0,"",17921,72993,73034,0,0,"A bird with big eyes was looking at something."
5,"https://media0.giphy.com/media/v1.Y2lkPWVjOWY5Nzk1eTF5YXRlMHlwZjRzOWtmYzZ1ZDMzMW",15,16,3027,14739,0,"",18218,91211,91252,0,0,"A man with a black shirt and brown hair was looking at something."
6,"https://media0.giphy.com/media/v1.Y2lkPWVjOWY5Nzk1eTF5YXRlMHlwZjRzOWtmYzZ1ZDMzMW",18,16,3042,14780,0,"",18270,109481,109522,0,0,"A man with black hair and wearing a shirt is looking up and talking."
7,"https://media4.giphy.com/media/v1.Y2lkPWVjOWY5Nzk1eTF5YXRlMHlwZjRzOWtmYzZ1ZDMzMW",63,16,3086,14708,1,"TRAITORS “Who Doesn't Like Surprises?",18250,127731,127772,0,0,"A man with a hat and coat smiles at something on the screen.. Text: TRAITORS “Who Doesn't Like Surprises?"
8,"https://media0.giphy.com/media/v1.Y2lkPWVjOWY5Nzk1eTF5YXRlMHlwZjRzOWtmYzZ1ZDMzMW",32,16,3062,14603,0,"",18099,145830,145871,0,0,"A woman with blonde hair and blue eyes wearing glasses ."
9,"https://media2.giphy.com/media/v1.Y2lkPWVjOWY5Nzk1eTF5YXRlMHlwZjRzOWtmYzZ1ZDMzMW",35,16,3048,14569,0,"",18069,163899,163940,0,0,"A woman with red and blue colors was shocked by something."
10,"https://media3.giphy.com/media/v1.Y2lkPWVjOWY5Nzk1eTF5YXRlMHlwZjRzOWtmYzZ1ZDMzMW",46,16,3078,14934,0,"",18468,182367,182408,0,0,"A boy with black hair and wearing a fire truck shirt was walking on dirt roads near trees."