gif_index,url,total_gif_frames,frames_extracted,frame_extraction_ms,total_inference_ms,ocr_detected,ocr_text,total_pipeline_ms,wall_clock_ms,since_page_load_ms,model_load_ms,ocr_load_ms,caption
1,"https://media3.giphy.com/media/v1.Y2lkPWVjOWY5Nzk1bmZ5MnVhcHhvemF0Z2wxZWNyd2tkej",16,16,3760,3280,1,"ay Ce",32959,32966,33066,25496,475,"GIF displays A man with a tie and shirt was talking while sitting at a desk, with text saying ay Ce"
2,"https://media2.giphy.com/media/v1.Y2lkPWVjOWY5Nzk1bmZ5MnVhcHhvemF0Z2wxZWNyd2tkej",63,16,3287,2301,1,"TRAITORS “Who Doesn't Like Surprises?",6152,39119,39219,0,0,"GIF displays A man with a hat and coat smiles at something on the screen, with text saying TRAITORS Who Doesn't Like Surprises"
3,"https://media3.giphy.com/media/v1.Y2lkPWVjOWY5Nzk1bmZ5MnVhcHhvemF0Z2wxZWNyd2tkej",96,16,3238,2435,0,"",6209,45330,45430,0,0,"GIF displays A man wearing headphones and a white shirt was talking into the microphone on stage"
4,"https://media2.giphy.com/media/v1.Y2lkPWVjOWY5Nzk1bmZ5MnVhcHhvemF0Z2wxZWNyd2tkej",52,16,3143,2168,1,"TA-DA!",6004,51335,51435,0,0,"GIF displays A woman was smiling and then turned away, with text saying TA-DA"
5,"https://media4.giphy.com/media/v1.Y2lkPWVjOWY5Nzk1bmZ5MnVhcHhvemF0Z2wxZWNyd2tkej",101,16,3126,2403,1,"SURPRISE,",6079,57416,57516,0,0,"GIF displays A box of surprise dogs sits inside another box and the other also has a dog sitting on top it, with text saying SURPRISE"
6,"https://media2.giphy.com/media/v1.Y2lkPWVjOWY5Nzk1bmZ5MnVhcHhvemF0Z2wxZWNyd2tkej",91,16,3297,2291,1,"Surprise! Surprise!",6110,63528,63627,0,0,"GIF displays A woman was walking on stage and waving her hand behind her, with text saying Surprise! Surprise"
7,"https://media4.giphy.com/media/v1.Y2lkPWVjOWY5Nzk1bmZ5MnVhcHhvemF0Z2wxZWNyd2tkej",15,16,3034,2297,0,"",5865,69393,69493,0,0,"GIF displays A man with a black shirt and brown hair was looking at something"
8,"https://media2.giphy.com/media/v1.Y2lkPWVjOWY5Nzk1bmZ5MnVhcHhvemF0Z2wxZWNyd2tkej",18,16,3104,2631,1,"SURPRISE",6265,75655,75755,0,0,"GIF displays A man wearing a suit and tie stands on stage with his hands up, with text saying SURPRISE"
9,"https://media3.giphy.com/media/v1.Y2lkPWVjOWY5Nzk1bmZ5MnVhcHhvemF0Z2wxZWNyd2tkej",46,16,3192,2656,0,"",6364,82019,82119,0,0,"GIF displays A boy with black hair and wearing a fire truck shirt was walking on dirt roads near trees"
10,"https://media3.giphy.com/media/v1.Y2lkPWVjOWY5Nzk1bmZ5MnVhcHhvemF0Z2wxZWNyd2tkej",26,16,3066,2368,0,"",5974,87996,88096,0,0,"GIF displays A bird with big eyes was looking at something"