gif_index,url,total_gif_frames,frames_extracted,frame_extraction_ms,total_inference_ms,ocr_detected,ocr_text,total_pipeline_ms,wall_clock_ms,since_page_load_ms,model_load_ms,ocr_load_ms,caption
1,"https://media3.giphy.com/media/v1.Y2lkPWVjOWY5Nzk1bmZ5MnVhcHhvemF0Z2wxZWNyd2tkej",16,16,3067,3000,1,"ay Ce",6532,6541,6582,25496,475,"GIF displays A man with a tie and shirt was talking while sitting at a desk, with text saying ay Ce"
2,"https://media2.giphy.com/media/v1.Y2lkPWVjOWY5Nzk1bmZ5MnVhcHhvemF0Z2wxZWNyd2tkej",63,16,3105,4114,1,"TRAITORS “Who Doesn't Like Surprises?",7722,14264,14306,0,0,"GIF displays A man with a hat and coat smiles at something on the screen, with text saying TRAITORS Who Doesn't Like Surprises"
3,"https://media3.giphy.com/media/v1.Y2lkPWVjOWY5Nzk1bmZ5MnVhcHhvemF0Z2wxZWNyd2tkej",96,16,3124,5063,0,"",8719,22984,23026,0,0,"GIF displays A man wearing headphones and a white shirt was talking into the microphone on stage"
4,"https://media2.giphy.com/media/v1.Y2lkPWVjOWY5Nzk1bmZ5MnVhcHhvemF0Z2wxZWNyd2tkej",52,16,3081,3796,1,"TA-DA!",7422,30405,30447,0,0,"GIF displays A woman was smiling and then turned away, with text saying TA-DA"
5,"https://media4.giphy.com/media/v1.Y2lkPWVjOWY5Nzk1bmZ5MnVhcHhvemF0Z2wxZWNyd2tkej",101,16,3081,4009,1,"SURPRISE,",7641,38048,38090,0,0,"GIF displays A box of surprise dogs sits inside another box and the other also has a dog sitting on top it, with text saying SURPRISE"
6,"https://media2.giphy.com/media/v1.Y2lkPWVjOWY5Nzk1bmZ5MnVhcHhvemF0Z2wxZWNyd2tkej",91,16,3127,5772,1,"Surprise! Surprise!",9420,47468,47510,0,0,"GIF displays A woman was walking on stage and waving her hand behind her, with text saying Surprise! Surprise"
7,"https://media4.giphy.com/media/v1.Y2lkPWVjOWY5Nzk1bmZ5MnVhcHhvemF0Z2wxZWNyd2tkej",15,16,3030,3599,0,"",7159,54627,54669,0,0,"GIF displays A man with a black shirt and brown hair was looking at something"
8,"https://media2.giphy.com/media/v1.Y2lkPWVjOWY5Nzk1bmZ5MnVhcHhvemF0Z2wxZWNyd2tkej",18,16,3059,4797,1,"SURPRISE",8408,63033,63075,0,0,"GIF displays A man wearing a suit and tie stands on stage with his hands up, with text saying SURPRISE"
9,"https://media3.giphy.com/media/v1.Y2lkPWVjOWY5Nzk1bmZ5MnVhcHhvemF0Z2wxZWNyd2tkej",46,16,3133,4441,0,"",8098,71132,71174,0,0,"GIF displays A boy with black hair and wearing a fire truck shirt was walking on dirt roads near trees"
10,"https://media3.giphy.com/media/v1.Y2lkPWVjOWY5Nzk1bmZ5MnVhcHhvemF0Z2wxZWNyd2tkej",26,16,3037,3283,0,"",6865,77999,78041,0,0,"GIF displays A bird with big eyes was looking at something"