gif_index,url,total_gif_frames,frames_extracted,frame_extraction_ms,total_inference_ms,ocr_detected,ocr_text,total_pipeline_ms,wall_clock_ms,since_page_load_ms,model_load_ms,ocr_load_ms,caption
1,"https://media2.giphy.com/media/v1.Y2lkPWVjOWY5Nzk1eTF5YXRlMHlwZjRzOWtmYzZ1ZDMzMW",91,16,3126,14639,1,"Surprise! Surprise!",18234,18238,18274,2120,219,"A woman was walking on stage and waving her hand behind her.. Text: Surprise! Surprise!"
2,"https://media3.giphy.com/media/v1.Y2lkPWVjOWY5Nzk1eTF5YXRlMHlwZjRzOWtmYzZ1ZDMzMW",16,16,3031,15022,1,"DER Sub PRISE!",18504,36742,36778,0,0,"A blue and yellow frame with text reading surprise! Surprise? sits on top of another image that. Text: DER Sub PRISE!"
3,"https://media1.giphy.com/media/v1.Y2lkPWVjOWY5Nzk1eTF5YXRlMHlwZjRzOWtmYzZ1ZDMzMW",16,16,3071,14806,1,"ay Ce",18331,55072,55108,0,0,"A man with a tie and shirt was talking while sitting at a desk.. Text: ay Ce"
4,"https://media0.giphy.com/media/v1.Y2lkPWVjOWY5Nzk1eTF5YXRlMHlwZjRzOWtmYzZ1ZDMzMW",26,16,3028,14494,0,"",17959,73031,73067,0,0,"A bird with big eyes was looking at something."
5,"https://media0.giphy.com/media/v1.Y2lkPWVjOWY5Nzk1eTF5YXRlMHlwZjRzOWtmYzZ1ZDMzMW",15,16,3026,14685,0,"",18163,91193,91230,0,0,"A man with a black shirt and brown hair was looking at something."
6,"https://media0.giphy.com/media/v1.Y2lkPWVjOWY5Nzk1eTF5YXRlMHlwZjRzOWtmYzZ1ZDMzMW",18,16,3044,14818,0,"",18297,109490,109527,0,0,"A man with black hair and wearing a shirt is looking up and talking."
7,"https://media4.giphy.com/media/v1.Y2lkPWVjOWY5Nzk1eTF5YXRlMHlwZjRzOWtmYzZ1ZDMzMW",63,16,3088,14752,1,"TRAITORS “Who Doesn't Like Surprises?",18291,127782,127818,0,0,"A man with a hat and coat smiles at something on the screen.. Text: TRAITORS “Who Doesn't Like Surprises?"
8,"https://media0.giphy.com/media/v1.Y2lkPWVjOWY5Nzk1eTF5YXRlMHlwZjRzOWtmYzZ1ZDMzMW",32,16,3058,14610,0,"",18122,145904,145940,0,0,"A woman with blonde hair and blue eyes wearing glasses ."
9,"https://media2.giphy.com/media/v1.Y2lkPWVjOWY5Nzk1eTF5YXRlMHlwZjRzOWtmYzZ1ZDMzMW",35,16,3057,14550,0,"",18053,163957,163993,0,0,"A woman with red and blue colors was shocked by something."
10,"https://media3.giphy.com/media/v1.Y2lkPWVjOWY5Nzk1eTF5YXRlMHlwZjRzOWtmYzZ1ZDMzMW",46,16,3079,15026,0,"",18563,182520,182556,0,0,"A boy with black hair and wearing a fire truck shirt was walking on dirt roads near trees."