gif_index,url,total_gif_frames,frames_extracted,frame_extraction_ms,total_inference_ms,ocr_detected,ocr_text,total_pipeline_ms,wall_clock_ms,since_page_load_ms,model_load_ms,ocr_load_ms,caption
1,"https://media3.giphy.com/media/v1.Y2lkPWVjOWY5Nzk1bmZ5MnVhcHhvemF0Z2wxZWNyd2tkej",16,16,3060,4428,0,"",7964,7969,8021,4309,192,"GIF displays A man with a tie and shirt was talking while sitting at a desk"
2,"https://media2.giphy.com/media/v1.Y2lkPWVjOWY5Nzk1bmZ5MnVhcHhvemF0Z2wxZWNyd2tkej",63,16,3120,3640,0,"",7272,15244,15295,0,0,"GIF displays A man with a hat and coat smiles at something on the screen"
3,"https://media3.giphy.com/media/v1.Y2lkPWVjOWY5Nzk1bmZ5MnVhcHhvemF0Z2wxZWNyd2tkej",96,16,3162,4623,0,"",8310,23557,23609,0,0,"GIF displays A man wearing headphones and a white shirt was talking into the microphone on stage"
4,"https://media2.giphy.com/media/v1.Y2lkPWVjOWY5Nzk1bmZ5MnVhcHhvemF0Z2wxZWNyd2tkej",52,16,3076,4519,0,"",8119,31672,31724,0,0,"GIF displays A woman was smiling and then turned away"
5,"https://media4.giphy.com/media/v1.Y2lkPWVjOWY5Nzk1bmZ5MnVhcHhvemF0Z2wxZWNyd2tkej",101,16,3081,4156,0,"",7762,39435,39487,0,0,"GIF displays A box of surprise dogs sits inside another box and the other also has a dog sitting on top it"
6,"https://media2.giphy.com/media/v1.Y2lkPWVjOWY5Nzk1bmZ5MnVhcHhvemF0Z2wxZWNyd2tkej",91,16,3125,3167,0,"",6807,46241,46293,0,0,"GIF displays A woman was walking on stage and waving her hand behind her"
7,"https://media4.giphy.com/media/v1.Y2lkPWVjOWY5Nzk1bmZ5MnVhcHhvemF0Z2wxZWNyd2tkej",15,16,3028,4371,0,"",7903,54145,54196,0,0,"GIF displays A man with a black shirt and brown hair was looking at something"
8,"https://media2.giphy.com/media/v1.Y2lkPWVjOWY5Nzk1bmZ5MnVhcHhvemF0Z2wxZWNyd2tkej",18,16,3058,5485,0,"",9067,63212,63263,0,0,"GIF displays A man wearing a suit and tie stands on stage with his hands up"
9,"https://media3.giphy.com/media/v1.Y2lkPWVjOWY5Nzk1bmZ5MnVhcHhvemF0Z2wxZWNyd2tkej",46,16,3088,4230,0,"",7838,71051,71102,0,0,"GIF displays A boy with black hair and wearing a fire truck shirt was walking on dirt roads near trees"
10,"https://media3.giphy.com/media/v1.Y2lkPWVjOWY5Nzk1bmZ5MnVhcHhvemF0Z2wxZWNyd2tkej",26,16,3040,3350,0,"",6916,77969,78021,0,0,"GIF displays A bird with big eyes was looking at something"