gif_index,url,total_gif_frames,frames_extracted,frame_extraction_ms,total_inference_ms,ocr_detected,ocr_text,total_pipeline_ms,wall_clock_ms,since_page_load_ms,model_load_ms,ocr_load_ms,caption
1,"https://media2.giphy.com/media/v1.Y2lkPWVjOWY5Nzk1MGQyaTBhajAxdGxvaml5cHU4aWZmbG",91,16,3102,14871,1,"Surprise! Surprise!",18400,18405,18457,24552,450,"A woman was walking on stage and waving her hand behind her.. Text: Surprise! Surprise!"
2,"https://media3.giphy.com/media/v1.Y2lkPWVjOWY5Nzk1MGQyaTBhajAxdGxvaml5cHU4aWZmbG",16,16,3059,14898,1,"ay Ce",18401,36806,36858,0,0,"A man with a tie and shirt was talking while sitting at a desk.. Text: ay Ce"
3,"https://media4.giphy.com/media/v1.Y2lkPWVjOWY5Nzk1MGQyaTBhajAxdGxvaml5cHU4aWZmbG",63,16,3082,14883,1,"TRAITORS “Who Doesn't Like Surprises?",18415,55221,55273,0,0,"A man with a hat and coat smiles at something on the screen.. Text: TRAITORS “Who Doesn't Like Surprises?"
4,"https://media1.giphy.com/media/v1.Y2lkPWVjOWY5Nzk1MGQyaTBhajAxdGxvaml5cHU4aWZmbG",18,16,3041,14977,0,"",18450,73671,73724,0,0,"A man with black hair and wearing a shirt is looking up and talking."
5,"https://media1.giphy.com/media/v1.Y2lkPWVjOWY5Nzk1MGQyaTBhajAxdGxvaml5cHU4aWZmbG",26,16,3030,14672,0,"",18136,91807,91859,0,0,"A bird with big eyes was looking at something."
6,"https://media1.giphy.com/media/v1.Y2lkPWVjOWY5Nzk1MGQyaTBhajAxdGxvaml5cHU4aWZmbG",16,16,3035,15753,1,"DER Sub PRISE!",19240,111047,111100,0,0,"A blue and yellow frame with text reading surprise! Surprise? sits on top of another image that. Text: DER Sub PRISE!"
7,"https://media4.giphy.com/media/v1.Y2lkPWVjOWY5Nzk1MGQyaTBhajAxdGxvaml5cHU4aWZmbG",35,16,3047,14756,0,"",18259,129306,129358,0,0,"A woman with red and blue colors was shocked by something."
8,"https://media4.giphy.com/media/v1.Y2lkPWVjOWY5Nzk1MGQyaTBhajAxdGxvaml5cHU4aWZmbG",32,16,3062,14834,0,"",18327,147634,147686,0,0,"A woman with blonde hair and blue eyes wearing glasses ."
9,"https://media4.giphy.com/media/v1.Y2lkPWVjOWY5Nzk1MGQyaTBhajAxdGxvaml5cHU4aWZmbG",46,16,3077,15056,0,"",18586,166221,166273,0,0,"A boy with black hair and wearing a fire truck shirt was walking on dirt roads near trees."
10,"https://media1.giphy.com/media/v1.Y2lkPWVjOWY5Nzk1MGQyaTBhajAxdGxvaml5cHU4aWZmbG",15,16,3025,14907,0,"",18379,184599,184651,0,0,"A man with a black shirt and brown hair was looking at something."