gif_index,url,total_gif_frames,frames_extracted,frame_extraction_ms,total_inference_ms,ocr_detected,ocr_text,total_pipeline_ms,wall_clock_ms,since_page_load_ms,model_load_ms,ocr_load_ms,caption
1,"https://media2.giphy.com/media/v1.Y2lkPWVjOWY5Nzk1OGxldnp0bG5maTF5cXlreXlhYnQ0OW",91,16,3132,15104,0,"",18674,18679,18717,27760,460,"A woman was walking on stage and waving her hand behind her."
2,"https://media3.giphy.com/media/v1.Y2lkPWVjOWY5Nzk1OGxldnp0bG5maTF5cXlreXlhYnQ0OW",16,16,3060,15169,0,"",18664,37343,37381,0,0,"A man with a tie and shirt was talking while sitting at a desk."
3,"https://media4.giphy.com/media/v1.Y2lkPWVjOWY5Nzk1OGxldnp0bG5maTF5cXlreXlhYnQ0OW",63,16,3121,15179,0,"",18737,56080,56118,0,0,"A man with a hat and coat smiles at something on the screen."
4,"https://media1.giphy.com/media/v1.Y2lkPWVjOWY5Nzk1OGxldnp0bG5maTF5cXlreXlhYnQ0OW",18,16,3043,15261,0,"",18737,74816,74855,0,0,"A man with black hair and wearing a shirt is looking up and talking."
5,"https://media1.giphy.com/media/v1.Y2lkPWVjOWY5Nzk1OGxldnp0bG5maTF5cXlreXlhYnQ0OW",26,16,3029,15007,0,"",18470,93287,93325,0,0,"A bird with big eyes was looking at something."
6,"https://media1.giphy.com/media/v1.Y2lkPWVjOWY5Nzk1OGxldnp0bG5maTF5cXlreXlhYnQ0OW",16,16,3034,15458,0,"",18930,112217,112255,0,0,"A blue and yellow frame with text reading surprise! Surprise? sits on top of another image that"
7,"https://media4.giphy.com/media/v1.Y2lkPWVjOWY5Nzk1OGxldnp0bG5maTF5cXlreXlhYnQ0OW",35,16,3045,15116,0,"",18598,130815,130854,0,0,"A woman with red and blue colors was shocked by something."
8,"https://media2.giphy.com/media/v1.Y2lkPWVjOWY5Nzk1OGxldnp0bG5maTF5cXlreXlhYnQ0OW",32,16,3062,15142,0,"",18643,149459,149497,0,0,"A woman with blonde hair and blue eyes wearing glasses ."
9,"https://media4.giphy.com/media/v1.Y2lkPWVjOWY5Nzk1OGxldnp0bG5maTF5cXlreXlhYnQ0OW",46,16,3070,15458,0,"",18964,168422,168460,0,0,"A boy with black hair and wearing a fire truck shirt was walking on dirt roads near trees."
10,"https://media1.giphy.com/media/v1.Y2lkPWVjOWY5Nzk1OGxldnp0bG5maTF5cXlreXlhYnQ0OW",15,16,3025,15230,0,"",18691,187113,187152,0,0,"A man with a black shirt and brown hair was looking at something."