gif_index,url,total_gif_frames,frames_extracted,frame_extraction_ms,total_inference_ms,ocr_detected,ocr_text,total_pipeline_ms,wall_clock_ms,since_page_load_ms,model_load_ms,ocr_load_ms,caption
1,"https://media3.giphy.com/media/v1.Y2lkPWVjOWY5Nzk1bmZ5MnVhcHhvemF0Z2wxZWNyd2tkej",16,16,3068,2522,1,"ay Ce",6065,6075,6114,25496,475,"GIF displays A man with a tie and shirt was talking while sitting at a desk, with text saying ay Ce"
2,"https://media2.giphy.com/media/v1.Y2lkPWVjOWY5Nzk1bmZ5MnVhcHhvemF0Z2wxZWNyd2tkej",63,16,3098,3776,1,"TRAITORS “Who Doesn't Like Surprises?",7382,13457,13496,0,0,"GIF displays A man with a hat and coat smiles at something on the screen, with text saying TRAITORS Who Doesn't Like Surprises"
3,"https://media3.giphy.com/media/v1.Y2lkPWVjOWY5Nzk1bmZ5MnVhcHhvemF0Z2wxZWNyd2tkej",96,16,3128,5237,0,"",8893,22352,22391,0,0,"GIF displays A man wearing headphones and a white shirt was talking into the microphone on stage"
4,"https://media2.giphy.com/media/v1.Y2lkPWVjOWY5Nzk1bmZ5MnVhcHhvemF0Z2wxZWNyd2tkej",52,16,3098,3568,1,"TA-DA!",7201,29553,29592,0,0,"GIF displays A woman was smiling and then turned away, with text saying TA-DA"
5,"https://media4.giphy.com/media/v1.Y2lkPWVjOWY5Nzk1bmZ5MnVhcHhvemF0Z2wxZWNyd2tkej",101,16,3092,3461,1,"SURPRISE,",7090,36641,36680,0,0,"GIF displays A box of surprise dogs sits inside another box and the other also has a dog sitting on top it, with text saying SURPRISE"
6,"https://media2.giphy.com/media/v1.Y2lkPWVjOWY5Nzk1bmZ5MnVhcHhvemF0Z2wxZWNyd2tkej",91,16,3125,3958,1,"Surprise! Surprise!",7614,44256,44295,0,0,"GIF displays A woman was walking on stage and waving her hand behind her, with text saying Surprise! Surprise"
7,"https://media4.giphy.com/media/v1.Y2lkPWVjOWY5Nzk1bmZ5MnVhcHhvemF0Z2wxZWNyd2tkej",15,16,3034,3015,0,"",6583,50837,50877,0,0,"GIF displays A man with a black shirt and brown hair was looking at something"
8,"https://media2.giphy.com/media/v1.Y2lkPWVjOWY5Nzk1bmZ5MnVhcHhvemF0Z2wxZWNyd2tkej",18,16,3060,3318,1,"SURPRISE",6911,57751,57790,0,0,"GIF displays A man wearing a suit and tie stands on stage with his hands up, with text saying SURPRISE"
9,"https://media3.giphy.com/media/v1.Y2lkPWVjOWY5Nzk1bmZ5MnVhcHhvemF0Z2wxZWNyd2tkej",46,16,3145,3615,0,"",7284,65034,65073,0,0,"GIF displays A boy with black hair and wearing a fire truck shirt was walking on dirt roads near trees"
10,"https://media3.giphy.com/media/v1.Y2lkPWVjOWY5Nzk1bmZ5MnVhcHhvemF0Z2wxZWNyd2tkej",26,16,3037,3976,0,"",7527,72560,72599,0,0,"GIF displays A bird with big eyes was looking at something"