gif_index,url,total_gif_frames,frames_extracted,frame_extraction_ms,total_inference_ms,ocr_detected,ocr_text,total_pipeline_ms,wall_clock_ms,since_page_load_ms,model_load_ms,ocr_load_ms,caption
1,"https://media2.giphy.com/media/v1.Y2lkPWVjOWY5Nzk1MGQyaTBhajAxdGxvaml5cHU4aWZmbG",91,16,3100,14774,1,"Surprise! Surprise!",18332,18336,18388,24552,450,"A woman was walking on stage and waving her hand behind her.. Text: Surprise! Surprise!"
2,"https://media3.giphy.com/media/v1.Y2lkPWVjOWY5Nzk1MGQyaTBhajAxdGxvaml5cHU4aWZmbG",16,16,3057,14995,1,"ay Ce",18480,36816,36869,0,0,"A man with a tie and shirt was talking while sitting at a desk.. Text: ay Ce"
3,"https://media4.giphy.com/media/v1.Y2lkPWVjOWY5Nzk1MGQyaTBhajAxdGxvaml5cHU4aWZmbG",63,16,3085,14802,1,"TRAITORS “Who Doesn't Like Surprises?",18319,55135,55187,0,0,"A man with a hat and coat smiles at something on the screen.. Text: TRAITORS “Who Doesn't Like Surprises?"
4,"https://media1.giphy.com/media/v1.Y2lkPWVjOWY5Nzk1MGQyaTBhajAxdGxvaml5cHU4aWZmbG",18,16,3045,14865,0,"",18363,73498,73550,0,0,"A man with black hair and wearing a shirt is looking up and talking."
5,"https://media1.giphy.com/media/v1.Y2lkPWVjOWY5Nzk1MGQyaTBhajAxdGxvaml5cHU4aWZmbG",26,16,3031,14655,0,"",18126,91623,91676,0,0,"A bird with big eyes was looking at something."
6,"https://media1.giphy.com/media/v1.Y2lkPWVjOWY5Nzk1MGQyaTBhajAxdGxvaml5cHU4aWZmbG",16,16,3031,15091,1,"DER Sub PRISE!",18577,110201,110253,0,0,"A blue and yellow frame with text reading surprise! Surprise? sits on top of another image that. Text: DER Sub PRISE!"
7,"https://media4.giphy.com/media/v1.Y2lkPWVjOWY5Nzk1MGQyaTBhajAxdGxvaml5cHU4aWZmbG",35,16,3045,14658,0,"",18143,128344,128397,0,0,"A woman with red and blue colors was shocked by something."
8,"https://media4.giphy.com/media/v1.Y2lkPWVjOWY5Nzk1MGQyaTBhajAxdGxvaml5cHU4aWZmbG",32,16,3066,14761,0,"",18266,146610,146662,0,0,"A woman with blonde hair and blue eyes wearing glasses ."
9,"https://media4.giphy.com/media/v1.Y2lkPWVjOWY5Nzk1MGQyaTBhajAxdGxvaml5cHU4aWZmbG",46,16,3065,15091,0,"",18580,165189,165242,0,0,"A boy with black hair and wearing a fire truck shirt was walking on dirt roads near trees."
10,"https://media1.giphy.com/media/v1.Y2lkPWVjOWY5Nzk1MGQyaTBhajAxdGxvaml5cHU4aWZmbG",15,16,3025,14858,0,"",18325,183514,183567,0,0,"A man with a black shirt and brown hair was looking at something."