gif_index,url,total_gif_frames,frames_extracted,frame_extraction_ms,total_inference_ms,ocr_detected,ocr_text,total_pipeline_ms,wall_clock_ms,since_page_load_ms,model_load_ms,ocr_load_ms,caption
1,"https://media3.giphy.com/media/v1.Y2lkPWVjOWY5Nzk1bmZ5MnVhcHhvemF0Z2wxZWNyd2tkej",16,16,3064,3142,0,"",6688,6695,6761,4309,192,"GIF displays A man with a tie and shirt was talking while sitting at a desk"
2,"https://media2.giphy.com/media/v1.Y2lkPWVjOWY5Nzk1bmZ5MnVhcHhvemF0Z2wxZWNyd2tkej",63,16,3094,3786,0,"",7386,14085,14151,0,0,"GIF displays A man with a hat and coat smiles at something on the screen"
3,"https://media3.giphy.com/media/v1.Y2lkPWVjOWY5Nzk1bmZ5MnVhcHhvemF0Z2wxZWNyd2tkej",96,16,3167,3025,0,"",6711,20796,20862,0,0,"GIF displays A man wearing headphones and a white shirt was talking into the microphone on stage"
4,"https://media2.giphy.com/media/v1.Y2lkPWVjOWY5Nzk1bmZ5MnVhcHhvemF0Z2wxZWNyd2tkej",52,16,3079,5403,0,"",8996,29789,29855,0,0,"GIF displays A woman was smiling and then turned away"
5,"https://media4.giphy.com/media/v1.Y2lkPWVjOWY5Nzk1bmZ5MnVhcHhvemF0Z2wxZWNyd2tkej",101,16,3083,3730,0,"",7329,37118,37184,0,0,"GIF displays A box of surprise dogs sits inside another box and the other also has a dog sitting on top it"
6,"https://media2.giphy.com/media/v1.Y2lkPWVjOWY5Nzk1bmZ5MnVhcHhvemF0Z2wxZWNyd2tkej",91,16,3128,3771,0,"",7432,44551,44617,0,0,"GIF displays A woman was walking on stage and waving her hand behind her"
7,"https://media4.giphy.com/media/v1.Y2lkPWVjOWY5Nzk1bmZ5MnVhcHhvemF0Z2wxZWNyd2tkej",15,16,3034,4592,0,"",8151,52702,52768,0,0,"GIF displays A man with a black shirt and brown hair was looking at something"
8,"https://media2.giphy.com/media/v1.Y2lkPWVjOWY5Nzk1bmZ5MnVhcHhvemF0Z2wxZWNyd2tkej",18,16,3058,4071,0,"",7654,60358,60425,0,0,"GIF displays A man wearing a suit and tie stands on stage with his hands up"
9,"https://media3.giphy.com/media/v1.Y2lkPWVjOWY5Nzk1bmZ5MnVhcHhvemF0Z2wxZWNyd2tkej",46,16,3083,4135,0,"",7722,68081,68147,0,0,"GIF displays A boy with black hair and wearing a fire truck shirt was walking on dirt roads near trees"
10,"https://media3.giphy.com/media/v1.Y2lkPWVjOWY5Nzk1bmZ5MnVhcHhvemF0Z2wxZWNyd2tkej",26,16,3034,5265,0,"",8822,76901,76967,0,0,"GIF displays A bird with big eyes was looking at something"