gif_index,url,total_gif_frames,frames_extracted,frame_extraction_ms,total_inference_ms,ocr_detected,ocr_text,total_pipeline_ms,wall_clock_ms,since_page_load_ms,model_load_ms,ocr_load_ms,caption
1,"https://media2.giphy.com/media/v1.Y2lkPWVjOWY5Nzk1MGQyaTBhajAxdGxvaml5cHU4aWZmbG",91,16,3099,14827,1,"Surprise! Surprise!",18387,18391,18439,24552,450,"A woman was walking on stage and waving her hand behind her.. Text: Surprise! Surprise!"
2,"https://media3.giphy.com/media/v1.Y2lkPWVjOWY5Nzk1MGQyaTBhajAxdGxvaml5cHU4aWZmbG",16,16,3060,14881,1,"ay Ce",18372,36763,36811,0,0,"A man with a tie and shirt was talking while sitting at a desk.. Text: ay Ce"
3,"https://media4.giphy.com/media/v1.Y2lkPWVjOWY5Nzk1MGQyaTBhajAxdGxvaml5cHU4aWZmbG",63,16,3082,14926,1,"TRAITORS “Who Doesn't Like Surprises?",18471,55234,55282,0,0,"A man with a hat and coat smiles at something on the screen.. Text: TRAITORS “Who Doesn't Like Surprises?"
4,"https://media1.giphy.com/media/v1.Y2lkPWVjOWY5Nzk1MGQyaTBhajAxdGxvaml5cHU4aWZmbG",18,16,3041,14949,0,"",18436,73669,73718,0,0,"A man with black hair and wearing a shirt is looking up and talking."
5,"https://media1.giphy.com/media/v1.Y2lkPWVjOWY5Nzk1MGQyaTBhajAxdGxvaml5cHU4aWZmbG",26,16,3029,14670,0,"",18146,91816,91864,0,0,"A bird with big eyes was looking at something."
6,"https://media1.giphy.com/media/v1.Y2lkPWVjOWY5Nzk1MGQyaTBhajAxdGxvaml5cHU4aWZmbG",16,16,3031,15175,1,"DER Sub PRISE!",18654,110470,110518,0,0,"A blue and yellow frame with text reading surprise! Surprise? sits on top of another image that. Text: DER Sub PRISE!"
7,"https://media4.giphy.com/media/v1.Y2lkPWVjOWY5Nzk1MGQyaTBhajAxdGxvaml5cHU4aWZmbG",35,16,3047,14764,0,"",18247,128717,128765,0,0,"A woman with red and blue colors was shocked by something."
8,"https://media4.giphy.com/media/v1.Y2lkPWVjOWY5Nzk1MGQyaTBhajAxdGxvaml5cHU4aWZmbG",32,16,3064,14768,0,"",18292,147009,147057,0,0,"A woman with blonde hair and blue eyes wearing glasses ."
9,"https://media4.giphy.com/media/v1.Y2lkPWVjOWY5Nzk1MGQyaTBhajAxdGxvaml5cHU4aWZmbG",46,16,3076,15047,0,"",18573,165582,165631,0,0,"A boy with black hair and wearing a fire truck shirt was walking on dirt roads near trees."
10,"https://media1.giphy.com/media/v1.Y2lkPWVjOWY5Nzk1MGQyaTBhajAxdGxvaml5cHU4aWZmbG",15,16,3025,14902,0,"",18371,183953,184001,0,0,"A man with a black shirt and brown hair was looking at something."