gif_index,url,total_gif_frames,frames_extracted,frame_extraction_ms,total_inference_ms,ocr_detected,ocr_text,total_pipeline_ms,wall_clock_ms,since_page_load_ms,model_load_ms,ocr_load_ms,caption
1,"https://media1.giphy.com/media/v1.Y2lkPWVjOWY5Nzk1aGdjejB0aXZvb21scTVuZmVoNXE1aj",26,6,2075,6087,0,"",8162,8168,8180,23221,204,"a white cat is licking a white rabbit.

the rabbit is licking the rabbit's face"
2,"https://media2.giphy.com/media/v1.Y2lkPWVjOWY5Nzk1aGdjejB0aXZvb21scTVuZmVoNXE1aj",21,6,2118,6161,1,"OO ge",8279,8285,8297,0,0,"a man is sitting on a bench and talking. he is smiling. he looks up and down. Text: OO ge"
3,"https://media1.giphy.com/media/v1.Y2lkPWVjOWY5Nzk1aGdjejB0aXZvb21scTVuZmVoNXE1aj",18,6,2142,6138,0,"",8280,8286,8298,0,0,"a man is talking and then looks up. he looks up and then down. he is smiling"
4,"https://media1.giphy.com/media/v1.Y2lkPWVjOWY5Nzk1aGdjejB0aXZvb21scTVuZmVoNXE1aj",16,6,2153,6126,1,"Vow Suh prise!",8279,8286,8298,0,0,"a man is playing a game with a ball.

the ball is moving around.. Text: Vow Suh prise!"
5,"https://media4.giphy.com/media/v1.Y2lkPWVjOWY5Nzk1aGdjejB0aXZvb21scTVuZmVoNXE1aj",35,6,2181,6100,0,"",8281,8287,8298,0,0,"a man is talking to a woman and then she turns around and smiles.

a man"
6,"https://media2.giphy.com/media/v1.Y2lkPWVjOWY5Nzk1aGdjejB0aXZvb21scTVuZmVoNXE1aj",32,6,2202,6078,0,"",8280,8287,8299,0,0,"a man is talking and smiling and then he looks up.

a man with a beard"
7,"https://media1.giphy.com/media/v1.Y2lkPWVjOWY5Nzk1aGdjejB0aXZvb21scTVuZmVoNXE1aj",16,6,2227,6055,1,"Ae ace",8282,8288,8299,0,0,"a man is talking and then he turns his head. he is smiling. he looks at the. Text: Ae ace"
8,"https://media2.giphy.com/media/v1.Y2lkPWVjOWY5Nzk1aGdjejB0aXZvb21scTVuZmVoNXE1aj",74,6,2234,6047,0,"",8280,8288,8300,0,0,"a man is talking and then looks up. Then he looks down. Then looks up again."
9,"https://media4.giphy.com/media/v1.Y2lkPWVjOWY5Nzk1aGdjejB0aXZvb21scTVuZmVoNXE1aj",63,6,2275,6007,1,"TRATFORS “Who Doesn't Like Surprises?",8282,8288,8300,0,0,"a man is talking to a woman and then she smiles.

a man in a blue. Text: TRATFORS “Who Doesn't Like Surprises?"
10,"https://media2.giphy.com/media/v1.Y2lkPWVjOWY5Nzk1aGdjejB0aXZvb21scTVuZmVoNXE1aj",91,6,2286,5997,1,"Surprise! Surprise!",8283,8289,8300,0,0,"a man is walking down a street and then he is walking away. he is smiling and then. Text: Surprise! Surprise!"