gif_index,url,total_gif_frames,frames_extracted,frame_extraction_ms,total_inference_ms,ocr_detected,ocr_text,total_pipeline_ms,wall_clock_ms,since_page_load_ms,model_load_ms,ocr_load_ms,caption
1,"https://media1.giphy.com/media/v1.Y2lkPWVjOWY5Nzk1aGdjejB0aXZvb21scTVuZmVoNXE1aj",16,6,1057,5982,0,"",7039,7043,7062,33855,197,"a man is playing a game with a ball.

the ball is moving around."
2,"https://media2.giphy.com/media/v1.Y2lkPWVjOWY5Nzk1aGdjejB0aXZvb21scTVuZmVoNXE1aj",21,6,1145,5957,0,"",7102,7106,7124,0,0,"a man is sitting on a bench and talking. he is smiling. he looks up and down"
3,"https://media1.giphy.com/media/v1.Y2lkPWVjOWY5Nzk1aGdjejB0aXZvb21scTVuZmVoNXE1aj",26,6,1169,5933,0,"",7102,7106,7124,0,0,"a white cat is licking a white rabbit.

the rabbit is licking the rabbit's face"
4,"https://media1.giphy.com/media/v1.Y2lkPWVjOWY5Nzk1aGdjejB0aXZvb21scTVuZmVoNXE1aj",18,6,1184,5919,0,"",7103,7107,7125,0,0,"a man is talking and then looks up. he looks up and then down. he is smiling"
5,"https://media1.giphy.com/media/v1.Y2lkPWVjOWY5Nzk1aGdjejB0aXZvb21scTVuZmVoNXE1aj",16,6,1196,5907,0,"",7103,7107,7126,0,0,"a man is talking and then he turns his head. he is smiling. he looks at the"
6,"https://media2.giphy.com/media/v1.Y2lkPWVjOWY5Nzk1aGdjejB0aXZvb21scTVuZmVoNXE1aj",74,6,1205,5898,0,"",7103,7108,7126,0,0,"a man is talking and then looks up. Then he looks down. Then looks up again."
7,"https://media4.giphy.com/media/v1.Y2lkPWVjOWY5Nzk1aGdjejB0aXZvb21scTVuZmVoNXE1aj",35,6,1216,5888,0,"",7104,7108,7126,0,0,"a man is talking to a woman and then she turns around and smiles.

a man"
8,"https://media2.giphy.com/media/v1.Y2lkPWVjOWY5Nzk1aGdjejB0aXZvb21scTVuZmVoNXE1aj",32,6,1225,5879,0,"",7104,7108,7127,0,0,"a man is talking and smiling and then he looks up.

a man with a beard"
9,"https://media4.giphy.com/media/v1.Y2lkPWVjOWY5Nzk1aGdjejB0aXZvb21scTVuZmVoNXE1aj",63,6,1255,5850,0,"",7105,7109,7127,0,0,"a man is talking to a woman and then she smiles.

a man in a blue"
10,"https://media2.giphy.com/media/v1.Y2lkPWVjOWY5Nzk1aGdjejB0aXZvb21scTVuZmVoNXE1aj",91,6,1265,5840,0,"",7105,7109,7127,0,0,"a man is walking down a street and then he is walking away. he is smiling and then"