gif_index,url,total_gif_frames,frames_extracted,frame_extraction_ms,total_inference_ms,ocr_detected,ocr_text,total_pipeline_ms,wall_clock_ms,since_page_load_ms,model_load_ms,ocr_load_ms,caption
1,"https://media1.giphy.com/media/v1.Y2lkPWVjOWY5Nzk1aGdjejB0aXZvb21scTVuZmVoNXE1aj",16,6,1064,5888,0,"",6952,6956,6970,33855,197,"a man is playing a game with a ball.

the ball is moving around."
2,"https://media2.giphy.com/media/v1.Y2lkPWVjOWY5Nzk1aGdjejB0aXZvb21scTVuZmVoNXE1aj",21,6,1146,6021,0,"",7167,7171,7185,0,0,"a man is sitting on a bench and talking. he is smiling. he looks up and down"
3,"https://media1.giphy.com/media/v1.Y2lkPWVjOWY5Nzk1aGdjejB0aXZvb21scTVuZmVoNXE1aj",26,6,1172,5996,0,"",7168,7171,7186,0,0,"a white cat is licking a white rabbit.

the rabbit is licking the rabbit's face"
4,"https://media1.giphy.com/media/v1.Y2lkPWVjOWY5Nzk1aGdjejB0aXZvb21scTVuZmVoNXE1aj",18,6,1209,5959,0,"",7168,7172,7186,0,0,"a man is talking and then looks up. he looks up and then down. he is smiling"
5,"https://media4.giphy.com/media/v1.Y2lkPWVjOWY5Nzk1aGdjejB0aXZvb21scTVuZmVoNXE1aj",35,6,1218,5950,0,"",7168,7172,7187,0,0,"a man is talking to a woman and then she turns around and smiles.

a man"
6,"https://media1.giphy.com/media/v1.Y2lkPWVjOWY5Nzk1aGdjejB0aXZvb21scTVuZmVoNXE1aj",16,6,1227,5942,0,"",7169,7173,7187,0,0,"a man is talking and then he turns his head. he is smiling. he looks at the"
7,"https://media2.giphy.com/media/v1.Y2lkPWVjOWY5Nzk1aGdjejB0aXZvb21scTVuZmVoNXE1aj",91,6,1236,5934,0,"",7169,7173,7187,0,0,"a man is walking down a street and then he is walking away. he is smiling and then"
8,"https://media2.giphy.com/media/v1.Y2lkPWVjOWY5Nzk1aGdjejB0aXZvb21scTVuZmVoNXE1aj",74,6,1244,5924,0,"",7168,7174,7188,0,0,"a man is talking and then looks up. Then he looks down. Then looks up again."
9,"https://media2.giphy.com/media/v1.Y2lkPWVjOWY5Nzk1aGdjejB0aXZvb21scTVuZmVoNXE1aj",32,6,1254,5915,0,"",7169,7174,7188,0,0,"a man is talking and smiling and then he looks up.

a man with a beard"
10,"https://media4.giphy.com/media/v1.Y2lkPWVjOWY5Nzk1aGdjejB0aXZvb21scTVuZmVoNXE1aj",63,6,1268,5902,0,"",7170,7175,7189,0,0,"a man is talking to a woman and then she smiles.

a man in a blue"