gif_index,url,total_gif_frames,frames_extracted,frame_extraction_ms,total_inference_ms,ocr_detected,ocr_text,total_pipeline_ms,wall_clock_ms,since_page_load_ms,model_load_ms,ocr_load_ms,caption
1,"https://media1.giphy.com/media/v1.Y2lkPWVjOWY5Nzk1aGdjejB0aXZvb21scTVuZmVoNXE1aj",26,6,2081,6143,0,"",8225,8229,8244,23221,204,"a white cat is licking a white rabbit.

the rabbit is licking the rabbit's face"
2,"https://media2.giphy.com/media/v1.Y2lkPWVjOWY5Nzk1aGdjejB0aXZvb21scTVuZmVoNXE1aj",21,6,2116,6261,1,"OO ge",8377,8381,8396,0,0,"a man is sitting on a bench and talking. he is smiling. he looks up and down. Text: OO ge"
3,"https://media1.giphy.com/media/v1.Y2lkPWVjOWY5Nzk1aGdjejB0aXZvb21scTVuZmVoNXE1aj",18,6,2135,6243,0,"",8378,8382,8396,0,0,"a man is talking and then looks up. he looks up and then down. he is smiling"
4,"https://media1.giphy.com/media/v1.Y2lkPWVjOWY5Nzk1aGdjejB0aXZvb21scTVuZmVoNXE1aj",16,6,2154,6223,1,"Vow Suh prise!",8377,8382,8397,0,0,"a man is playing a game with a ball.

the ball is moving around.. Text: Vow Suh prise!"
5,"https://media4.giphy.com/media/v1.Y2lkPWVjOWY5Nzk1aGdjejB0aXZvb21scTVuZmVoNXE1aj",35,6,2164,6215,0,"",8379,8382,8397,0,0,"a man is talking to a woman and then she turns around and smiles.

a man"
6,"https://media1.giphy.com/media/v1.Y2lkPWVjOWY5Nzk1aGdjejB0aXZvb21scTVuZmVoNXE1aj",16,6,2226,6153,1,"Ae ace",8379,8383,8398,0,0,"a man is talking and then he turns his head. he is smiling. he looks at the. Text: Ae ace"
7,"https://media2.giphy.com/media/v1.Y2lkPWVjOWY5Nzk1aGdjejB0aXZvb21scTVuZmVoNXE1aj",32,6,2234,6145,0,"",8379,8383,8398,0,0,"a man is talking and smiling and then he looks up.

a man with a beard"
8,"https://media4.giphy.com/media/v1.Y2lkPWVjOWY5Nzk1aGdjejB0aXZvb21scTVuZmVoNXE1aj",63,6,2244,6135,1,"TRATFORS “Who Doesn't Like Surprises?",8380,8384,8398,0,0,"a man is talking to a woman and then she smiles.

a man in a blue. Text: TRATFORS “Who Doesn't Like Surprises?"
9,"https://media2.giphy.com/media/v1.Y2lkPWVjOWY5Nzk1aGdjejB0aXZvb21scTVuZmVoNXE1aj",74,6,2254,6125,0,"",8379,8384,8399,0,0,"a man is talking and then looks up. Then he looks down. Then looks up again."
10,"https://media2.giphy.com/media/v1.Y2lkPWVjOWY5Nzk1aGdjejB0aXZvb21scTVuZmVoNXE1aj",91,6,2296,6084,1,"Surprise! Surprise!",8380,8384,8399,0,0,"a man is walking down a street and then he is walking away. he is smiling and then. Text: Surprise! Surprise!"